{
  "schema_version":"upstream_pin/v1","tool_manifest_id":"stateweaver-foundation","repository_url":"https://github.com/taipei49314/stateweaver",
  "source":{"default_branch":"main","commit_sha":"598753d182dda65c73a313e9efbf20b826942f0a","tree_sha":"e8f89a72235ab0db33149bcfdc616f825ebe68ad"},
  "software_version":"0.1.0","release":null,
  "evidence":[{"kind":"actions_artifact","id":"9185829493","name":"stateweaver-candidate-8c7c77d59d4cf3abdcadcce3f2d110ca085789da1ec14a2301245f3418b78bc3","subject_commit_sha":"598753d182dda65c73a313e9efbf20b826942f0a","sha256":"5d02880586dcf9075043ca4a08212eef4be1d6c3b3dc2c5d6c87744746f6d1f0","size_bytes":33040252,"status":"verified_at_admission","expires_at":"2026-11-11T14:42:48Z"}],
  "runtime":{"kind":"python","target_os":"linux","target_arch":"x86_64","version_constraint":"CPython 3.13.15 cp313","interpreter_included":false,"transitive_dependencies_included":true,"self_contained":false,"external_tools":[]},
  "native_posture":{"status":"CANDIDATE_READY_FOR_EXTERNAL_QUALIFICATION","release_eligible":false},
  "execution_readiness":{"state":"fail_closed","scope":"fixed_synthetic_foundation","blocker_codes":["candidate_is_not_execution_capsule","host_runtime_target_mismatch","python_interpreter_not_included"]},
  "admission":{"evidence_integrity_state":"verified_at_admission","authority_effect":"none"},"license_spdx":"Apache-2.0"
}
