{
  "schema_version":"upstream_pin/v1","tool_manifest_id":"greenwash","repository_url":"https://github.com/taipei49314/greenwash",
  "source":{"default_branch":"main","commit_sha":"bd33898ddf7396054ce58d438ff02934bcf7e27b","tree_sha":"fee1e8ca956f0a6a66632376de3f8893b195e915"},
  "software_version":"0.1.41","release":null,
  "evidence":[{"kind":"workflow_run","id":"31867786471","name":"ci","subject_commit_sha":"bd33898ddf7396054ce58d438ff02934bcf7e27b","sha256":null,"size_bytes":null,"status":"success","expires_at":null}],
  "runtime":{"kind":"python","target_os":"any","target_arch":"any","version_constraint":">=3.11","interpreter_included":false,"transitive_dependencies_included":false,"self_contained":false,"external_tools":["git"]},
  "native_posture":{"status":"SOURCE_VERIFIED","release_eligible":null},
  "execution_readiness":{"state":"fail_closed","scope":"exact_range_check","blocker_codes":["ambient_git_not_bound","git_metadata_not_materialized","python_interpreter_not_included","python_stdlib_not_included"]},
  "admission":{"evidence_integrity_state":"source_verified","authority_effect":"none"},"license_spdx":"Apache-2.0"
}
